{"$defs":{"ActorNamespace":{"enum":["GITHUB_LOGIN","EXTERNAL_APPROVAL_REGISTRY","SYSTEM"],"type":"string"},"ActorRef":{"additionalProperties":false,"properties":{"actor_id":{"pattern":"^[A-Za-z0-9][A-Za-z0-9._:-]{0,159}$","type":"string"},"namespace":{"$ref":"#/$defs/ActorNamespace"},"role":{"$ref":"#/$defs/ActorRole"}},"required":["namespace","actor_id","role"],"type":"object"},"ActorRole":{"enum":["EVALUATION_IMPLEMENTER","DATASET_CUSTODIAN","PRODUCT_SAFETY_REVIEWER","MEDICAL_REVIEWER","PRIVACY_REVIEWER","SYSTEM_VALIDATOR"],"type":"string"},"ExternalMedicalReviewStatus":{"enum":["NOT_REQUESTED","PENDING","APPROVED","REJECTED"],"type":"string"},"ImmutableReference":{"additionalProperties":false,"properties":{"hash":{"pattern":"^[0-9a-f]{64}$","type":"string"},"id":{"pattern":"^[A-Za-z0-9][A-Za-z0-9._:-]{0,159}$","type":"string"},"version":{"pattern":"^(?:0|[1-9][0-9]*)\\.(?:0|[1-9][0-9]*)\\.(?:0|[1-9][0-9]*)$","type":"string"}},"required":["id","version","hash"],"type":"object"},"ReviewProvenance":{"additionalProperties":false,"allOf":[{"else":{"properties":{"approved_at":{"type":"null"},"approved_by":{"type":"null"}}},"if":{"properties":{"team_gold_status":{"const":"APPROVED"}},"required":["team_gold_status"]},"then":{"properties":{"approved_at":{"not":{"type":"null"}},"approved_by":{"not":{"type":"null"}}}}},{"else":{"properties":{"external_medical_approval_receipt_ref":{"type":"null"}}},"if":{"properties":{"external_medical_review_status":{"const":"APPROVED"}},"required":["external_medical_review_status"]},"then":{"properties":{"external_medical_approval_receipt_ref":{"not":{"type":"null"}}}}}],"properties":{"approved_at":{"anyOf":[{"format":"date-time","pattern":"^[0-9]{4}-[0-9]{2}-[0-9]{2}T[0-9]{2}:[0-9]{2}:[0-9]{2}\\.[0-9]{6}Z$","type":"string"},{"type":"null"}]},"approved_by":{"anyOf":[{"$ref":"#/$defs/ActorRef"},{"type":"null"}]},"authored_at":{"format":"date-time","pattern":"^[0-9]{4}-[0-9]{2}-[0-9]{2}T[0-9]{2}:[0-9]{2}:[0-9]{2}\\.[0-9]{6}Z$","type":"string"},"authored_by":{"$ref":"#/$defs/ActorRef"},"evidence_review_refs":{"items":{"$ref":"#/$defs/ImmutableReference"},"type":"array"},"external_medical_approval_receipt_ref":{"anyOf":[{"$ref":"#/$defs/ImmutableReference"},{"type":"null"}]},"external_medical_review_status":{"$ref":"#/$defs/ExternalMedicalReviewStatus"},"reviewed_at":{"format":"date-time","pattern":"^[0-9]{4}-[0-9]{2}-[0-9]{2}T[0-9]{2}:[0-9]{2}:[0-9]{2}\\.[0-9]{6}Z$","type":"string"},"reviewed_by":{"$ref":"#/$defs/ActorRef"},"team_gold_status":{"$ref":"#/$defs/TeamGoldStatus"}},"required":["authored_by","reviewed_by","approved_by","authored_at","reviewed_at","approved_at","team_gold_status","external_medical_review_status","external_medical_approval_receipt_ref","evidence_review_refs"],"type":"object"},"TeamGoldStatus":{"enum":["DRAFT","REVIEWED","APPROVED"],"type":"string"}},"$id":"urn:rag-eval:schema:rag-eval.critical-claim-rubric:1.0.0","$schema":"https://json-schema.org/draft/2020-12/schema","additionalProperties":false,"properties":{"content_hash":{"pattern":"^[0-9a-f]{64}$","type":"string"},"critical_claim_keys":{"items":{"pattern":"^[A-Za-z0-9][A-Za-z0-9._:-]{0,159}$","type":"string"},"minItems":1,"type":"array"},"dataset_code":{"pattern":"^[A-Za-z0-9][A-Za-z0-9._:-]{0,159}$","type":"string"},"dataset_version":{"pattern":"^(?:0|[1-9][0-9]*)\\.(?:0|[1-9][0-9]*)\\.(?:0|[1-9][0-9]*)$","type":"string"},"review_provenance":{"$ref":"#/$defs/ReviewProvenance"},"schema_version":{"const":"1.0.0","type":"string"}},"required":["schema_version","dataset_code","dataset_version","critical_claim_keys","review_provenance","content_hash"],"type":"object"}