{"content_hash":"d1ee3035a83c9c2aeece0d36b1a34a04b1e8d5edb4122340c582d692b76fba4f","critical_claim_keys":["SYNTHETIC_CLAIM_ANSWER_GROUNDING","SYNTHETIC_CLAIM_ANSWER_QUALITY","SYNTHETIC_CLAIM_END_TO_END"],"dataset_code":"rag-dev-foundation","dataset_version":"1.0.0","review_provenance":{"approved_at":"2026-09-01T00:00:00.000000Z","approved_by":{"actor_id":"synthetic-approver","namespace":"GITHUB_LOGIN","role":"DATASET_CUSTODIAN"},"authored_at":"2026-09-01T00:00:00.000000Z","authored_by":{"actor_id":"synthetic-author","namespace":"GITHUB_LOGIN","role":"EVALUATION_IMPLEMENTER"},"evidence_review_refs":[],"external_medical_approval_receipt_ref":null,"external_medical_review_status":"NOT_REQUESTED","reviewed_at":"2026-09-01T00:00:00.000000Z","reviewed_by":{"actor_id":"synthetic-privacy-reviewer","namespace":"GITHUB_LOGIN","role":"PRIVACY_REVIEWER"},"team_gold_status":"APPROVED"},"schema_version":"1.0.0"}
